{
  "schema_version": "0.1",
  "device_id": "CV-01",
  "source": "uploaded_snapshot",
  "captured_at": "2026-09-04T10:36:00+08:00",
  "expires_at": "2026-09-04T10:36:30+08:00",
  "revision": 200,
  "controller_online": true,
  "upstream_power_available": true,
  "drive_power_enabled": true,
  "drive_supply_voltage_v": 23.89,
  "drive_ready": true,
  "run_command": false,
  "infeed_enabled": false,
  "operating_mode": "MAINTENANCE",
  "production_requested": true,
  "belt_speed_m_s": 0,
  "infeed_count_total": 2332,
  "outfeed_count_total": 2329,
  "manual_removed_count_total": 0,
  "cabinet_temperature_c": 35.0,
  "emergency_stop_active": false,
  "maintenance_lockout": true,
  "guard_closed": true,
  "zone_clear": true,
  "downstream_ready": true,
  "unresolved_accumulation": false,
  "run_resume_permitted": false,
  "cooling_enabled": false,
  "cooling_fan_running": false,
  "cooling_fan_fault": false,
  "cooling_control_permitted": false,
  "thermal_pause_active": false,
  "temperature_recovery_ready": true
}
