{
  "schema_version": "0.1",
  "device_id": "CV-01",
  "source": "uploaded_snapshot",
  "captured_at": "2026-09-10T10:14:00+08:00",
  "expires_at": "2026-09-10T10:14:30+08:00",
  "revision": 200,
  "controller_online": true,
  "upstream_power_available": true,
  "drive_power_enabled": true,
  "drive_supply_voltage_v": 24.05,
  "drive_ready": true,
  "run_command": false,
  "infeed_enabled": false,
  "operating_mode": "PLANNED_STOP",
  "production_requested": false,
  "belt_speed_m_s": 0,
  "infeed_count_total": 7932,
  "outfeed_count_total": 7929,
  "manual_removed_count_total": 0,
  "cabinet_temperature_c": 35.1,
  "emergency_stop_active": false,
  "maintenance_lockout": false,
  "guard_closed": null,
  "zone_clear": null,
  "downstream_ready": true,
  "unresolved_accumulation": false,
  "run_resume_permitted": false,
  "cooling_enabled": false,
  "cooling_fan_running": false,
  "cooling_fan_fault": false,
  "cooling_control_permitted": true,
  "thermal_pause_active": false,
  "temperature_recovery_ready": true
}
