{
  "schema_version": "0.1",
  "device_id": "CV-01",
  "source": "uploaded_snapshot",
  "captured_at": "2026-09-11T11:14:00+08:00",
  "expires_at": "2026-09-11T11:14:30+08:00",
  "revision": 200,
  "controller_online": null,
  "upstream_power_available": null,
  "drive_power_enabled": null,
  "drive_supply_voltage_v": null,
  "drive_ready": null,
  "run_command": null,
  "infeed_enabled": null,
  "operating_mode": "UNKNOWN",
  "production_requested": null,
  "belt_speed_m_s": null,
  "infeed_count_total": null,
  "outfeed_count_total": null,
  "manual_removed_count_total": null,
  "cabinet_temperature_c": null,
  "emergency_stop_active": null,
  "maintenance_lockout": null,
  "guard_closed": null,
  "zone_clear": null,
  "downstream_ready": null,
  "unresolved_accumulation": null,
  "run_resume_permitted": null,
  "cooling_enabled": null,
  "cooling_fan_running": null,
  "cooling_fan_fault": null,
  "cooling_control_permitted": null,
  "thermal_pause_active": null,
  "temperature_recovery_ready": null
}
